{
  "name": "Health Insurance Portability and Accountability Act (AI Provisions)",
  "jurisdiction": "United States Federal",
  "jurisdiction_type": "federal",
  "scope": {
    "deployment_modes": ["all"],
    "data_types": ["PHI", "ePHI"],
    "use_case_categories": ["Healthcare AI systems processing protected health information"],
    "risk_tiers": ["critical", "high"],
    "description": "Applies to covered entities and business associates using AI systems that create, receive, maintain, or transmit PHI."
  },
  "requirements": [
    {"id": "HIPAA-164.308a1", "obligation": "Conduct risk analysis of AI systems processing PHI", "category": "risk_assessment", "penalty": "Up to $2.1M per violation category per year"},
    {"id": "HIPAA-164.312a", "obligation": "Implement access controls for AI endpoints processing PHI", "category": "security", "penalty": "Up to $2.1M per violation category per year"},
    {"id": "HIPAA-164.312b", "obligation": "Implement audit controls recording AI system activity involving PHI", "category": "audit_retention", "penalty": "Up to $2.1M per violation category per year"},
    {"id": "HIPAA-164.312e", "obligation": "Implement transmission security for PHI sent to AI processing endpoints", "category": "security", "penalty": "Up to $2.1M per violation category per year"},
    {"id": "HIPAA-164.308a5", "obligation": "Train workforce on AI system PHI handling procedures", "category": "human_oversight", "penalty": "Up to $2.1M per violation category per year"},
    {"id": "HIPAA-164.408", "obligation": "Notify affected individuals and HHS of AI-related PHI breaches", "category": "incident_reporting", "penalty": "Up to $2.1M per violation category per year"}
  ],
  "effective_date": "1996-08-21",
  "ai_risk_tier": "Maps to GAIF Critical for all AI systems processing PHI",
  "mapping": {
    "compliance_routing_rules": ["Route PHI-containing queries only to HIPAA-compliant endpoints", "Implement compliance-aware routing (GAIF Safety Pattern 1)", "Require BAA for all Tier B vendor AI services processing PHI"],
    "behavioral_contract_thresholds": ["Safety field: PHI exposure rate = 0% (zero tolerance)", "Conf field: 99.9% confidence on PHI routing decisions"],
    "disclosure_requirements": ["Minimum necessary standard applied to AI query construction"],
    "monitoring_requirements": ["Continuous monitoring of PHI exposure in AI query/response logs", "Audit trail retention per HIPAA requirements"],
    "audit_retention_days": 2190
  },
  "citation": "45 CFR Parts 160 and 164",
  "url": "https://www.hhs.gov/hipaa/index.html",
  "last_updated": "2026-03-30",
  "contributor": "Aman Sharma (ORCID: 0009-0005-5107-4485)"
}
