{
  "name": "EU Artificial Intelligence Act",
  "jurisdiction": "European Union",
  "jurisdiction_type": "supranational",
  "scope": {
    "deployment_modes": ["all"],
    "data_types": ["all"],
    "use_case_categories": ["all AI systems placed on EU market or affecting EU persons"],
    "risk_tiers": ["unacceptable", "high", "limited", "minimal"],
    "description": "Applies to providers and deployers of AI systems in the EU market, including systems developed outside the EU whose output is used in the EU."
  },
  "requirements": [
    {
      "id": "AIA-Art6",
      "obligation": "Risk classification of AI systems into four tiers: unacceptable (prohibited), high-risk, limited-risk, and minimal-risk",
      "category": "risk_assessment",
      "penalty": "Up to 35M EUR or 7% global annual turnover"
    },
    {
      "id": "AIA-Art9",
      "obligation": "High-risk AI systems must establish a risk management system throughout the system lifecycle",
      "category": "risk_assessment",
      "penalty": "Up to 15M EUR or 3% global annual turnover"
    },
    {
      "id": "AIA-Art10",
      "obligation": "Training, validation, and testing data sets must meet quality criteria including relevance, representativeness, and freedom from errors",
      "category": "data_governance",
      "penalty": "Up to 15M EUR or 3% global annual turnover"
    },
    {
      "id": "AIA-Art11",
      "obligation": "Technical documentation must be drawn up before system is placed on market and kept up to date",
      "category": "documentation",
      "penalty": "Up to 15M EUR or 3% global annual turnover"
    },
    {
      "id": "AIA-Art12",
      "obligation": "High-risk AI systems must allow for automatic recording of events (logs) throughout the system lifetime",
      "category": "audit_retention",
      "penalty": "Up to 15M EUR or 3% global annual turnover"
    },
    {
      "id": "AIA-Art13",
      "obligation": "High-risk AI systems must be designed to enable deployers to interpret system output and use it appropriately",
      "category": "transparency",
      "penalty": "Up to 15M EUR or 3% global annual turnover"
    },
    {
      "id": "AIA-Art14",
      "obligation": "High-risk AI systems must be designed to enable effective human oversight during use",
      "category": "human_oversight",
      "penalty": "Up to 15M EUR or 3% global annual turnover"
    },
    {
      "id": "AIA-Art15",
      "obligation": "High-risk AI systems must achieve appropriate levels of accuracy, robustness, and cybersecurity",
      "category": "security",
      "penalty": "Up to 15M EUR or 3% global annual turnover"
    },
    {
      "id": "AIA-Art50",
      "obligation": "Users must be notified when interacting with an AI system, when content is AI-generated, and when emotion recognition or biometric categorization is used",
      "category": "disclosure",
      "penalty": "Up to 15M EUR or 3% global annual turnover"
    },
    {
      "id": "AIA-Art51",
      "obligation": "High-risk AI systems must be registered in the EU database before being placed on market",
      "category": "registration",
      "penalty": "Up to 15M EUR or 3% global annual turnover"
    },
    {
      "id": "AIA-Art62",
      "obligation": "Providers must report serious incidents to market surveillance authorities",
      "category": "incident_reporting",
      "penalty": "Up to 15M EUR or 3% global annual turnover"
    },
    {
      "id": "AIA-Art72",
      "obligation": "Providers must establish post-market monitoring systems proportionate to the nature and risk of the AI system",
      "category": "risk_assessment",
      "penalty": "Up to 15M EUR or 3% global annual turnover"
    }
  ],
  "effective_date": "2026-08-02",
  "ai_risk_tier": "Maps to GAIF Critical for high-risk AI systems (Annex III), GAIF Medium for limited-risk, GAIF Low for minimal-risk",
  "mapping": {
    "compliance_routing_rules": [
      "Route high-risk AI queries through compliant endpoints with Art. 10 data governance",
      "Block prohibited AI use cases (Art. 5) at routing layer"
    ],
    "behavioral_contract_thresholds": [
      "Safety field must include Art. 15 accuracy, robustness targets",
      "Behav_v increment triggers re-assessment against Art. 9 risk management"
    ],
    "disclosure_requirements": [
      "Art. 50 transparency: label AI-generated content",
      "Art. 13 interpretability: provide output explanations for high-risk systems"
    ],
    "monitoring_requirements": [
      "Art. 72 post-market monitoring: continuous behavioral monitoring",
      "Art. 12 logging: automatic event recording throughout lifetime"
    ],
    "audit_retention_days": 3650
  },
  "citation": "Regulation (EU) 2024/1689 of the European Parliament and of the Council (AI Act)",
  "url": "https://eur-lex.europa.eu/eli/reg/2024/1689/oj",
  "last_updated": "2026-03-30",
  "contributor": "Aman Sharma (ORCID: 0009-0005-5107-4485)"
}
